[
  {
    "schema_version": 1,
    "run_id": "RUN-1792791316971-68379-6",
    "category": "traceability-gap",
    "end_line": null,
    "end_column": null,
    "certainty": null,
    "requirement_ids": [],
    "test_ids": [],
    "related_findings": [],
    "human_disposition_ref": null,
    "id": "FND-000001",
    "tool": "safety-trace",
    "rule_id": "trace-8364526acdaa3f89",
    "file": "harness/navigation_harness.c",
    "line": 5,
    "column": 5,
    "severity": "warning",
    "message": "Annotations differ across translation-unit contexts; automatic mapping is ambiguous",
    "build_variant": "VAR-894f317f36556005a1e7ba2065d4ad58dec7ce4de0eba4c541f626e085e5861f",
    "outcome": "DIAGNOSTIC",
    "native_references": [
      "trace.json"
    ]
  },
  {
    "schema_version": 1,
    "run_id": "RUN-1792791316971-68379-6",
    "category": "traceability-gap",
    "end_line": null,
    "end_column": null,
    "certainty": null,
    "requirement_ids": [],
    "test_ids": [],
    "related_findings": [],
    "human_disposition_ref": null,
    "id": "FND-000002",
    "tool": "safety-trace",
    "rule_id": "trace-46b45d335c4ec8bb",
    "file": "src/controller.cpp",
    "line": 3,
    "column": 21,
    "severity": "warning",
    "message": "Untraced code symbol controller::apply",
    "build_variant": "VAR-14293ae00cdb67bf01d89dd6357f091a59dc38a7daa885428bd03167fd741f0e",
    "outcome": "DIAGNOSTIC",
    "native_references": [
      "trace.json",
      "trace.json"
    ]
  },
  {
    "schema_version": 1,
    "run_id": "RUN-1792791316971-68379-6",
    "category": "traceability-gap",
    "end_line": null,
    "end_column": null,
    "certainty": null,
    "requirement_ids": [],
    "test_ids": [],
    "related_findings": [],
    "human_disposition_ref": null,
    "id": "FND-000003",
    "tool": "safety-trace",
    "rule_id": "trace-46b45d335c4ec8bb",
    "file": "src/controller.cpp",
    "line": 4,
    "column": 5,
    "severity": "warning",
    "message": "Untraced code symbol controller::apply",
    "build_variant": "VAR-14293ae00cdb67bf01d89dd6357f091a59dc38a7daa885428bd03167fd741f0e",
    "outcome": "DIAGNOSTIC",
    "native_references": [
      "trace.json"
    ]
  },
  {
    "schema_version": 1,
    "run_id": "RUN-1792791316971-68379-6",
    "category": "traceability-gap",
    "end_line": null,
    "end_column": null,
    "certainty": null,
    "requirement_ids": [],
    "test_ids": [],
    "related_findings": [],
    "human_disposition_ref": null,
    "id": "FND-000004",
    "tool": "safety-trace",
    "rule_id": "trace-8364526acdaa3f89",
    "file": "src/test.c",
    "line": 4,
    "column": 5,
    "severity": "warning",
    "message": "Annotations differ across translation-unit contexts; automatic mapping is ambiguous",
    "build_variant": "VAR-9ff35ff903434396903470597bbfe339f5cb6dcdd3927ada3c925391aaf00180",
    "outcome": "DIAGNOSTIC",
    "native_references": [
      "trace.json"
    ]
  },
  {
    "schema_version": 1,
    "run_id": "RUN-1792791316971-68379-6",
    "category": "traceability-gap",
    "end_line": null,
    "end_column": null,
    "certainty": null,
    "requirement_ids": [],
    "test_ids": [],
    "related_findings": [],
    "human_disposition_ref": null,
    "id": "FND-000005",
    "tool": "safety-trace",
    "rule_id": "trace-2c678235a40616be",
    "file": "trace.yaml",
    "line": 1,
    "column": 1,
    "severity": "warning",
    "message": "Requirement R-ORPHAN has no linked implementation",
    "build_variant": "default",
    "outcome": "DIAGNOSTIC",
    "native_references": [
      "trace.json"
    ]
  },
  {
    "schema_version": 1,
    "run_id": "RUN-1792791316971-68379-6",
    "category": "traceability-gap",
    "end_line": null,
    "end_column": null,
    "certainty": null,
    "requirement_ids": [],
    "test_ids": [],
    "related_findings": [],
    "human_disposition_ref": null,
    "id": "FND-000006",
    "tool": "safety-trace",
    "rule_id": "trace-370b43f8611d36ef",
    "file": "trace.yaml",
    "line": 1,
    "column": 1,
    "severity": "warning",
    "message": "Broken reference R-ORPHAN -> UNKNOWN-TEST",
    "build_variant": "default",
    "outcome": "DIAGNOSTIC",
    "native_references": [
      "trace.json"
    ]
  },
  {
    "schema_version": 1,
    "run_id": "RUN-1792791316971-68379-6",
    "category": "traceability-gap",
    "end_line": null,
    "end_column": null,
    "certainty": null,
    "requirement_ids": [],
    "test_ids": [],
    "related_findings": [],
    "human_disposition_ref": null,
    "id": "FND-000007",
    "tool": "safety-trace",
    "rule_id": "trace-d57bd5409c13e002",
    "file": "trace.yaml",
    "line": 1,
    "column": 1,
    "severity": "warning",
    "message": "Requirement R-CTRL has no linked test",
    "build_variant": "default",
    "outcome": "DIAGNOSTIC",
    "native_references": [
      "trace.json"
    ]
  },
  {
    "schema_version": 1,
    "run_id": "RUN-1792791316971-68379-6",
    "category": "traceability-gap",
    "end_line": null,
    "end_column": null,
    "certainty": null,
    "requirement_ids": [],
    "test_ids": [],
    "related_findings": [],
    "human_disposition_ref": null,
    "id": "FND-000008",
    "tool": "safety-trace",
    "rule_id": "trace-db4027b75e18935b",
    "file": "trace.yaml",
    "line": 1,
    "column": 1,
    "severity": "warning",
    "message": "Requirement R-ORPHAN has no linked test",
    "build_variant": "default",
    "outcome": "DIAGNOSTIC",
    "native_references": [
      "trace.json"
    ]
  }
]