[
  {
    "id": "FND-000001",
    "tool": "safety-trace",
    "rule_id": "trace-46b45d335c4ec8bb",
    "file": "src/controller.cpp",
    "line": 3,
    "column": 21,
    "severity": "warning",
    "message": "Untraced code symbol controller::apply",
    "build_variant": "VAR-14293ae00cdb67bf01d89dd6357f091a59dc38a7daa885428bd03167fd741f0e",
    "outcome": "DIAGNOSTIC",
    "native_references": [
      "trace.json"
    ]
  },
  {
    "id": "FND-000002",
    "tool": "safety-trace",
    "rule_id": "trace-46b45d335c4ec8bb",
    "file": "src/controller.cpp",
    "line": 4,
    "column": 5,
    "severity": "warning",
    "message": "Untraced code symbol controller::apply",
    "build_variant": "VAR-14293ae00cdb67bf01d89dd6357f091a59dc38a7daa885428bd03167fd741f0e",
    "outcome": "DIAGNOSTIC",
    "native_references": [
      "trace.json"
    ]
  },
  {
    "id": "FND-000003",
    "tool": "safety-trace",
    "rule_id": "trace-2c678235a40616be",
    "file": "trace.yaml",
    "line": 1,
    "column": 1,
    "severity": "warning",
    "message": "Requirement R-ORPHAN has no linked implementation",
    "build_variant": "manifest",
    "outcome": "DIAGNOSTIC",
    "native_references": [
      "trace.json"
    ]
  },
  {
    "id": "FND-000004",
    "tool": "safety-trace",
    "rule_id": "trace-370b43f8611d36ef",
    "file": "trace.yaml",
    "line": 1,
    "column": 1,
    "severity": "warning",
    "message": "Broken reference R-ORPHAN -> UNKNOWN-TEST",
    "build_variant": "manifest",
    "outcome": "DIAGNOSTIC",
    "native_references": [
      "trace.json"
    ]
  },
  {
    "id": "FND-000005",
    "tool": "safety-trace",
    "rule_id": "trace-d57bd5409c13e002",
    "file": "trace.yaml",
    "line": 1,
    "column": 1,
    "severity": "warning",
    "message": "Requirement R-CTRL has no linked test",
    "build_variant": "manifest",
    "outcome": "DIAGNOSTIC",
    "native_references": [
      "trace.json"
    ]
  },
  {
    "id": "FND-000006",
    "tool": "safety-trace",
    "rule_id": "trace-db4027b75e18935b",
    "file": "trace.yaml",
    "line": 1,
    "column": 1,
    "severity": "warning",
    "message": "Requirement R-ORPHAN has no linked test",
    "build_variant": "manifest",
    "outcome": "DIAGNOSTIC",
    "native_references": [
      "trace.json"
    ]
  }
]