[
  {
    "id": "FND-000001",
    "tool": "clang-tidy-19",
    "rule_id": "safety-prohibited-goto",
    "file": "src/navigation.c",
    "line": 6,
    "column": 16,
    "severity": "warning",
    "message": "goto statement requires project policy review",
    "build_variant": "VAR-59d26e56ac42efbf896ef09f1788fdd1129c016477634b0d86e449897570a99e",
    "outcome": "DIAGNOSTIC",
    "native_references": [
      "raw/clang-0.log"
    ]
  }
]